{
  "directive": "db",
  "end_label": ".fall_height",
  "entries": [
    {
      "entry_file_offset": 297872,
      "expression": "$10",
      "literal_value": 16,
      "source_label": ".ether_medallion",
      "source_line": 1620,
      "source_revision": "347c23f9fc019c72d32da537c9cb235f468d021d",
      "table_index": 0
    },
    {
      "entry_file_offset": 297873,
      "expression": "$37",
      "literal_value": 55,
      "source_label": ".pendants",
      "source_line": 1624,
      "source_revision": "347c23f9fc019c72d32da537c9cb235f468d021d",
      "table_index": 1
    },
    {
      "entry_file_offset": 297874,
      "expression": "$39",
      "literal_value": 57,
      "source_label": ".pendants",
      "source_line": 1624,
      "source_revision": "347c23f9fc019c72d32da537c9cb235f468d021d",
      "table_index": 2
    },
    {
      "entry_file_offset": 297875,
      "expression": "$38",
      "literal_value": 56,
      "source_label": ".pendants",
      "source_line": 1624,
      "source_revision": "347c23f9fc019c72d32da537c9cb235f468d021d",
      "table_index": 3
    },
    {
      "entry_file_offset": 297876,
      "expression": "$26",
      "literal_value": 38,
      "source_label": ".heart_container",
      "source_line": 1628,
      "source_revision": "347c23f9fc019c72d32da537c9cb235f468d021d",
      "table_index": 4
    },
    {
      "entry_file_offset": 297877,
      "expression": "$0F",
      "literal_value": 15,
      "source_label": ".bombos_medallion",
      "source_line": 1632,
      "source_revision": "347c23f9fc019c72d32da537c9cb235f468d021d",
      "table_index": 5
    },
    {
      "entry_file_offset": 297878,
      "expression": "$20",
      "literal_value": 32,
      "source_label": ".crystal",
      "source_line": 1636,
      "source_revision": "347c23f9fc019c72d32da537c9cb235f468d021d",
      "table_index": 6
    }
  ],
  "entry_count": 7,
  "entry_width": 1,
  "format": "zelda-suite-data-table",
  "format_version": 1,
  "parent_label": "Pool_AddPendantOrCrystal",
  "source_file": "ancilla_init.asm",
  "source_revision": "347c23f9fc019c72d32da537c9cb235f468d021d",
  "table_file_offset": 297872,
  "table_label": ".item_values"
}
