{
  "directive": "dw",
  "end_label": null,
  "entries": [
    {
      "entry_file_offset": 1002707,
      "expression": "$0000",
      "literal_value": 0,
      "source_label": "CrystalMaiden_Configure_palette",
      "source_line": 6,
      "source_revision": "347c23f9fc019c72d32da537c9cb235f468d021d",
      "table_index": 0
    },
    {
      "entry_file_offset": 1002709,
      "expression": "$3821",
      "literal_value": 14369,
      "source_label": "CrystalMaiden_Configure_palette",
      "source_line": 6,
      "source_revision": "347c23f9fc019c72d32da537c9cb235f468d021d",
      "table_index": 1
    },
    {
      "entry_file_offset": 1002711,
      "expression": "$4463",
      "literal_value": 17507,
      "source_label": "CrystalMaiden_Configure_palette",
      "source_line": 6,
      "source_revision": "347c23f9fc019c72d32da537c9cb235f468d021d",
      "table_index": 2
    },
    {
      "entry_file_offset": 1002713,
      "expression": "$54A5",
      "literal_value": 21669,
      "source_label": "CrystalMaiden_Configure_palette",
      "source_line": 6,
      "source_revision": "347c23f9fc019c72d32da537c9cb235f468d021d",
      "table_index": 3
    },
    {
      "entry_file_offset": 1002715,
      "expression": "$5CE7",
      "literal_value": 23783,
      "source_label": "CrystalMaiden_Configure_palette",
      "source_line": 6,
      "source_revision": "347c23f9fc019c72d32da537c9cb235f468d021d",
      "table_index": 4
    },
    {
      "entry_file_offset": 1002717,
      "expression": "$6D29",
      "literal_value": 27945,
      "source_label": "CrystalMaiden_Configure_palette",
      "source_line": 6,
      "source_revision": "347c23f9fc019c72d32da537c9cb235f468d021d",
      "table_index": 5
    },
    {
      "entry_file_offset": 1002719,
      "expression": "$79AD",
      "literal_value": 31149,
      "source_label": "CrystalMaiden_Configure_palette",
      "source_line": 6,
      "source_revision": "347c23f9fc019c72d32da537c9cb235f468d021d",
      "table_index": 6
    },
    {
      "entry_file_offset": 1002721,
      "expression": "$7E10",
      "literal_value": 32272,
      "source_label": "CrystalMaiden_Configure_palette",
      "source_line": 6,
      "source_revision": "347c23f9fc019c72d32da537c9cb235f468d021d",
      "table_index": 7
    }
  ],
  "entry_count": 8,
  "entry_width": 2,
  "format": "zelda-suite-data-table",
  "format_version": 1,
  "parent_label": null,
  "source_file": "sprite_crystal_maiden.asm",
  "source_revision": "347c23f9fc019c72d32da537c9cb235f468d021d",
  "table_file_offset": 1002707,
  "table_label": "CrystalMaiden_Configure_palette"
}
