{
  "directive": "db",
  "end_label": null,
  "entries": [
    {
      "entry_file_offset": 297914,
      "expression": "$40",
      "literal_value": 64,
      "source_label": ".delay_timers",
      "source_line": 1652,
      "source_revision": "347c23f9fc019c72d32da537c9cb235f468d021d",
      "table_index": 0
    },
    {
      "entry_file_offset": 297915,
      "expression": "$00",
      "literal_value": 0,
      "source_label": ".delay_timers",
      "source_line": 1652,
      "source_revision": "347c23f9fc019c72d32da537c9cb235f468d021d",
      "table_index": 1
    },
    {
      "entry_file_offset": 297916,
      "expression": "$00",
      "literal_value": 0,
      "source_label": ".delay_timers",
      "source_line": 1652,
      "source_revision": "347c23f9fc019c72d32da537c9cb235f468d021d",
      "table_index": 2
    },
    {
      "entry_file_offset": 297917,
      "expression": "$00",
      "literal_value": 0,
      "source_label": ".delay_timers",
      "source_line": 1652,
      "source_revision": "347c23f9fc019c72d32da537c9cb235f468d021d",
      "table_index": 3
    },
    {
      "entry_file_offset": 297918,
      "expression": "$00",
      "literal_value": 0,
      "source_label": ".delay_timers",
      "source_line": 1652,
      "source_revision": "347c23f9fc019c72d32da537c9cb235f468d021d",
      "table_index": 4
    },
    {
      "entry_file_offset": 297919,
      "expression": "$FF",
      "literal_value": 255,
      "source_label": ".delay_timers",
      "source_line": 1652,
      "source_revision": "347c23f9fc019c72d32da537c9cb235f468d021d",
      "table_index": 5
    },
    {
      "entry_file_offset": 297920,
      "expression": "$00",
      "literal_value": 0,
      "source_label": ".delay_timers",
      "source_line": 1652,
      "source_revision": "347c23f9fc019c72d32da537c9cb235f468d021d",
      "table_index": 6
    }
  ],
  "entry_count": 7,
  "entry_width": 1,
  "format": "zelda-suite-data-table",
  "format_version": 1,
  "parent_label": "Pool_AddPendantOrCrystal",
  "source_file": "ancilla_init.asm",
  "source_revision": "347c23f9fc019c72d32da537c9cb235f468d021d",
  "table_file_offset": 297914,
  "table_label": ".delay_timers"
}
