{
  "directive": "dw",
  "end_label": ".delay_timers",
  "entries": [
    {
      "entry_file_offset": 297900,
      "expression": "$0078",
      "literal_value": 120,
      "source_label": ".x_offsets",
      "source_line": 1648,
      "source_revision": "347c23f9fc019c72d32da537c9cb235f468d021d",
      "table_index": 0
    },
    {
      "entry_file_offset": 297902,
      "expression": "$0078",
      "literal_value": 120,
      "source_label": ".x_offsets",
      "source_line": 1648,
      "source_revision": "347c23f9fc019c72d32da537c9cb235f468d021d",
      "table_index": 1
    },
    {
      "entry_file_offset": 297904,
      "expression": "$0078",
      "literal_value": 120,
      "source_label": ".x_offsets",
      "source_line": 1648,
      "source_revision": "347c23f9fc019c72d32da537c9cb235f468d021d",
      "table_index": 2
    },
    {
      "entry_file_offset": 297906,
      "expression": "$0078",
      "literal_value": 120,
      "source_label": ".x_offsets",
      "source_line": 1648,
      "source_revision": "347c23f9fc019c72d32da537c9cb235f468d021d",
      "table_index": 3
    },
    {
      "entry_file_offset": 297908,
      "expression": "$0078",
      "literal_value": 120,
      "source_label": ".x_offsets",
      "source_line": 1648,
      "source_revision": "347c23f9fc019c72d32da537c9cb235f468d021d",
      "table_index": 4
    },
    {
      "entry_file_offset": 297910,
      "expression": "$0080",
      "literal_value": 128,
      "source_label": ".x_offsets",
      "source_line": 1648,
      "source_revision": "347c23f9fc019c72d32da537c9cb235f468d021d",
      "table_index": 5
    },
    {
      "entry_file_offset": 297912,
      "expression": "$0078",
      "literal_value": 120,
      "source_label": ".x_offsets",
      "source_line": 1648,
      "source_revision": "347c23f9fc019c72d32da537c9cb235f468d021d",
      "table_index": 6
    }
  ],
  "entry_count": 7,
  "entry_width": 2,
  "format": "zelda-suite-data-table",
  "format_version": 1,
  "parent_label": "Pool_AddPendantOrCrystal",
  "source_file": "ancilla_init.asm",
  "source_revision": "347c23f9fc019c72d32da537c9cb235f468d021d",
  "table_file_offset": 297900,
  "table_label": ".x_offsets"
}
