{
  "directive": "dw",
  "end_label": ".x_offsets",
  "entries": [
    {
      "entry_file_offset": 297886,
      "expression": "$0048",
      "literal_value": 72,
      "source_label": ".y_offsets",
      "source_line": 1644,
      "source_revision": "347c23f9fc019c72d32da537c9cb235f468d021d",
      "table_index": 0
    },
    {
      "entry_file_offset": 297888,
      "expression": "$0078",
      "literal_value": 120,
      "source_label": ".y_offsets",
      "source_line": 1644,
      "source_revision": "347c23f9fc019c72d32da537c9cb235f468d021d",
      "table_index": 1
    },
    {
      "entry_file_offset": 297890,
      "expression": "$0078",
      "literal_value": 120,
      "source_label": ".y_offsets",
      "source_line": 1644,
      "source_revision": "347c23f9fc019c72d32da537c9cb235f468d021d",
      "table_index": 2
    },
    {
      "entry_file_offset": 297892,
      "expression": "$0078",
      "literal_value": 120,
      "source_label": ".y_offsets",
      "source_line": 1644,
      "source_revision": "347c23f9fc019c72d32da537c9cb235f468d021d",
      "table_index": 3
    },
    {
      "entry_file_offset": 297894,
      "expression": "$0078",
      "literal_value": 120,
      "source_label": ".y_offsets",
      "source_line": 1644,
      "source_revision": "347c23f9fc019c72d32da537c9cb235f468d021d",
      "table_index": 4
    },
    {
      "entry_file_offset": 297896,
      "expression": "$0068",
      "literal_value": 104,
      "source_label": ".y_offsets",
      "source_line": 1644,
      "source_revision": "347c23f9fc019c72d32da537c9cb235f468d021d",
      "table_index": 5
    },
    {
      "entry_file_offset": 297898,
      "expression": "$0078",
      "literal_value": 120,
      "source_label": ".y_offsets",
      "source_line": 1644,
      "source_revision": "347c23f9fc019c72d32da537c9cb235f468d021d",
      "table_index": 6
    }
  ],
  "entry_count": 7,
  "entry_width": 2,
  "format": "zelda-suite-data-table",
  "format_version": 1,
  "parent_label": "Pool_AddPendantOrCrystal",
  "source_file": "ancilla_init.asm",
  "source_revision": "347c23f9fc019c72d32da537c9cb235f468d021d",
  "table_file_offset": 297886,
  "table_label": ".y_offsets"
}
